[
  {
    "id": "S01",
    "title": "The Demo Where Your Work Became His",
    "category": "Credit and visibility",
    "difficulty": "medium",
    "scenario": "You spent three weeks rebuilding the checkout page's rendering pipeline. LCP dropped from 4.1s to 1.6s. In the monthly product review with the Director, your peer Karthik, who did the dashboard screenshots and two small PRs, presents the slide and says \"we optimised the checkout flow.\" The Director says \"Great work, Karthik.\" Your manager nods. You were in the room and said nothing. The review ends in five minutes.",
    "question": "What would you do? Think about the next five minutes, the next 24 hours, and the next quarter.",
    "principles": [
      {
        "source": "The 48 Laws of Power",
        "citation": "Law 5: So Much Depends on Reputation – Guard It with Your Life",
        "idea": "Reputation is built from what decision-makers repeatedly see. If credit drifts once without correction it tends to drift again. Guard it calmly and early."
      },
      {
        "source": "The 48 Laws of Power",
        "citation": "Law 9: Win Through Your Actions, Never Through Argument",
        "idea": "Proving it with artefacts (PRs, metrics, a write-up) persuades more than arguing about who did what."
      },
      {
        "source": "The 33 Strategies of War",
        "citation": "Strategy 8: Pick Your Battles Carefully – The Perfect-Economy Strategy",
        "idea": "Don't spend capital on a public confrontation in front of the Director. Spend a little effort where it pays: the written record and the next forum."
      },
      {
        "source": "The Laws of Human Nature",
        "citation": "Ch. 1: Master Your Emotional Self – The Law of Irrationality",
        "idea": "The urge to correct him right there in the room is emotional. Let it pass and act from a cooler state."
      }
    ],
    "sampleResponse": "In the room: if there is a natural opening, add detail without a correction tone, e.g. \"To add to that, the main gain came from moving the price calculation off the main thread and streaming the cart. Happy to walk anyone through the profiling.\" Detail signals ownership without accusing anyone. Within 24 hours: send a short write-up to my manager (cc the team channel, not the Director directly): what changed, before/after metrics, PR links, and what's next. Then ask my manager 1:1: \"I want to make sure my work on checkout perf is visible for my review cycle. How do you suggest I present it to the Director next time?\" That asks for sponsorship and doesn't complain. With Karthik, privately and neutrally: \"Next time let's split the slide. I'll present the perf part since I'll get the deep questions.\" Next quarter: make visibility a habit. Write demo notes, put my name on design docs, present my own work. One incident is noise. A pattern goes into a factual 1:1 with dates.",
    "commonMistake": "Either staying silent and stewing (then venting to colleagues, which reaches Karthik and makes her look petty), or correcting him sharply in front of the Director (\"Actually, I did that\"), which comes across as insecure and puts the Director in an awkward spot. Both treat it as an injury to her instead of a visibility problem she can fix."
  },
  {
    "id": "S02",
    "title": "The Favourite",
    "category": "Manager dynamics",
    "difficulty": "hard",
    "scenario": "Your manager, Sunil, has started routing every high-visibility project to Arjun, who joined eight months ago. They go for chai together and share a hometown. You have more experience and a better delivery record. A new 'AI assistant in the admin console' initiative was just announced, the kind of project that makes someone a Lead. You hear Arjun is already 'helping scope it.'",
    "question": "What would you do?",
    "principles": [
      {
        "source": "The 48 Laws of Power",
        "citation": "Law 19: Know Who You're Dealing With – Do Not Offend the Wrong Person",
        "idea": "Read Sunil accurately. What does he need, what does he fear, what makes him look good to his boss? Favouritism is often about comfort and trust more than merit."
      },
      {
        "source": "The 48 Laws of Power",
        "citation": "Law 13: When Asking for Help, Appeal to People's Self-Interest, Never to Their Mercy or Gratitude",
        "idea": "\"I deserve it\" or \"I've been loyal\" is weak. \"This is how I'd de-risk the launch for you\" is strong."
      },
      {
        "source": "The 33 Strategies of War",
        "citation": "Strategy 13: Know Your Enemy – The Intelligence Strategy",
        "idea": "Here the 'enemy' is the situation, not Arjun. Learn what the initiative's success criteria are, who sponsors it, and what Sunil is being measured on."
      },
      {
        "source": "Arthashastra (Kautilya)",
        "citation": "Book 1, Ch. 7 (paraphrase): sovereignty is possible only with assistance; a single wheel cannot move",
        "idea": "Power runs through relationships. Being excellent alone without allies is a structural weakness, not a moral virtue."
      }
    ],
    "sampleResponse": "I wouldn't compete with Arjun on chai. I'd compete on usefulness. First, I'd learn what the AI initiative needs: is it an eval harness, streaming UI, guardrails, cost control? Second, in my 1:1 I'd bring a one-page proposal: \"I've been thinking about the admin AI assistant. Here are the three risks I see (latency, hallucinated actions, auth scoping) and how I'd handle them. I'd like to own the frontend/integration architecture. Arjun's welcome to take X.\" That makes me the low-risk choice for Sunil's own goals. Third, I'd widen my sponsors: the PM and the skip-level should see my work through demos and docs, so my career doesn't depend on one person's comfort. If after one or two cycles the pattern continues despite clear asks, I'd treat it as data about this team (useful for my job search), not as a verdict on me.",
    "commonMistake": "Complaining about 'unfairness' to HR or peers, becoming cold with Arjun, or quietly working harder and hoping someone notices. Effort without positioning rarely gets noticed, and visible resentment makes the manager more comfortable with the favourite."
  },
  {
    "id": "S03",
    "title": "Talked Over in the Design Review",
    "category": "Meetings and presence",
    "difficulty": "easy",
    "scenario": "In architecture reviews, Vikram, a senior backend engineer, regularly starts talking while you're mid-sentence. Today you were explaining why the React Server Components migration should be phased. He cut in with \"Yeah but basically we just need to move fast,\" and the discussion moved on. Two people looked at you.",
    "question": "What would you do?",
    "principles": [
      {
        "source": "The Laws of Human Nature",
        "citation": "Ch. 1: Master Your Emotional Self – The Law of Irrationality",
        "idea": "The sting is real, but a flustered reaction makes her look less senior than him. Composure is the asset here."
      },
      {
        "source": "The 33 Strategies of War",
        "citation": "Strategy 3: Amidst the Turmoil of Events, Do Not Lose Your Presence of Mind – The Counterbalance Strategy",
        "idea": "Under pressure, slow down. A calm, deliberate voice reclaims the floor better than a louder one."
      },
      {
        "source": "The 48 Laws of Power",
        "citation": "Law 4: Always Say Less Than Necessary",
        "idea": "Short, structured statements are harder to interrupt and carry more weight than long explanations."
      },
      {
        "source": "The 48 Laws of Power",
        "citation": "Law 34: Be Royal in Your Own Fashion: Act Like a King to Be Treated Like One",
        "idea": "People treat you the way you carry yourself. Claim the floor as if it's normal that you have it."
      }
    ],
    "sampleResponse": "In the moment: hold up a hand slightly and say evenly, \"Let me finish this point, it's relevant to speed,\" then make it in two sentences: \"Phasing is the fast option. A big-bang migration means one bad hydration bug blocks every release.\" Then turn it back: \"Vikram, what's your concern with phasing?\" That shows I'm not rattled and pulls him into my framing. Before the next review: send a short pre-read so my position is on record before anyone can talk over it. Ask the facilitator to go round the room on key decisions. If it keeps happening, a private, non-accusatory word with Vikram: \"I notice we keep cutting across each other in reviews. I want to hear your points fully, and I'd like to finish mine.\"",
    "commonMistake": "Going quiet for the rest of the meeting and replaying it all evening, or snapping (\"Can you please let me talk!\") in a way that makes her look emotional. Another trap is assuming it's personal hostility when it may just be his habit with everyone. Find out before escalating."
  },
  {
    "id": "S04",
    "title": "The Peer Who Undermines in Small Ways",
    "category": "Peer conflict",
    "difficulty": "hard",
    "scenario": "Divya, a peer at your level, leaves condescending code review comments on your PRs (\"Not sure this was thought through?\"), mentions in standup that \"the frontend is always the bottleneck,\" and in a Slack thread with your manager wrote that your component library \"has a lot of tech debt.\" None of it is quite outrageous, but over time it adds up to a narrative.",
    "question": "What would you do?",
    "principles": [
      {
        "source": "The Laws of Human Nature",
        "citation": "Ch. 16: See the Hostility Behind the Friendly Facade – The Law of Aggression",
        "idea": "Chronic small digs are often a covert form of aggression or competition. Recognise the pattern early, before the narrative hardens."
      },
      {
        "source": "The 33 Strategies of War",
        "citation": "Strategy 25: Occupy the Moral High Ground – The Righteous Strategy",